name,html_url,stargazers_count,forks,description,homepage,language,created_at,updated_at
dedupe-variable-employer,https://github.com/datamade/dedupe-variable-employer,0,0,,,Python,2015-12-10T18:29:30Z,2016-03-01T16:16:27Z
snow_routes,https://github.com/datamade/snow_routes,0,0,,,,2015-12-12T00:04:18Z,2015-12-12T00:04:18Z
pupa,https://github.com/datamade/pupa,0,0,framework for scraping legislative/government data,,Python,2015-12-16T18:06:23Z,2016-01-19T19:05:27Z
python-opencivicdata-django,https://github.com/datamade/python-opencivicdata-django,0,0,python utilities for Open Civic Data,,Python,2015-12-27T17:13:28Z,2016-02-02T15:18:28Z
sunspots,https://github.com/datamade/sunspots,1,0,Trends for Illinois Sunshine,,Python,2016-01-26T15:41:42Z,2016-08-04T02:17:49Z
my-reps-pbp,https://github.com/datamade/my-reps-pbp,1,0,Look up who represents you at various levels of government.,http://myreps.participatorybudgeting.org/,JavaScript,2016-02-11T19:27:47Z,2016-06-28T19:16:13Z
councilmatic-starter-template,https://github.com/datamade/councilmatic-starter-template,3,4,:clipboard: starter code & documentation for new councilmatic instances,,Python,2016-02-22T22:42:06Z,2016-12-23T18:28:36Z
oeem-energy-datastore,https://github.com/datamade/oeem-energy-datastore,0,0,Datastore for Open Energy Efficiency Meter,,Python,2016-03-15T15:12:29Z,2016-03-15T15:12:30Z
rollcalls,https://github.com/datamade/rollcalls,0,0,Get roll call spreadsheets from Open States,,Python,2016-03-25T17:43:24Z,2016-09-06T18:33:52Z
probableparsing,https://github.com/datamade/probableparsing,2,0,Common methods for probable parsers,,Python,2016-03-28T22:07:42Z,2016-08-02T18:50:26Z
schema_matching,https://github.com/datamade/schema_matching,1,0,Notes for schema matching,,TeX,2016-04-05T19:41:55Z,2016-09-20T19:08:54Z
abstention,https://github.com/datamade/abstention,0,0,NYC Abstainers,,Makefile,2016-04-05T23:12:54Z,2016-09-06T18:34:28Z
python-crfsuite,https://github.com/datamade/python-crfsuite,0,0,A python binding for crfsuite,,Python,2016-04-08T16:06:30Z,2016-04-08T16:06:31Z
crfsuite,https://github.com/datamade/crfsuite,0,0,CRFsuite: a fast implementation of Conditional Random Fields (CRFs),http://www.chokkan.org/software/crfsuite/,C++,2016-04-10T20:40:25Z,2016-04-10T20:40:26Z
doublemetaphone,https://github.com/datamade/doublemetaphone,1,1,,,C++,2016-04-11T18:11:19Z,2016-04-11T18:24:17Z
ihs-charts,https://github.com/datamade/ihs-charts,0,0,interactive charts for DePaul Institute for Housing Studies,https://www.housingstudies.org/research-publications/state-of-housing/2016-state-rental-housing-cook-county/,HTML,2016-04-15T21:52:16Z,2016-10-24T18:40:14Z
connect-chicago-locator,https://github.com/datamade/connect-chicago-locator,0,0,Search for and view information about places where you can use a computer for free in Chicago. Part of the Connect Chicago website.,locations.weconnectchicago.org,Ruby,2016-04-18T02:29:44Z,2016-04-18T02:29:45Z
arrests,https://github.com/datamade/arrests,0,0,Chicago Police Arrests,,Python,2016-04-18T16:09:06Z,2016-04-19T18:47:43Z
where-the-work-is,https://github.com/datamade/where-the-work-is,0,0,:briefcase: visualizing middle-skilled occupations in the uk,http://wheretheworkis.org/,JavaScript,2016-04-18T16:38:51Z,2016-09-08T14:48:08Z
oversight,https://github.com/datamade/oversight,1,0,knitting together Chicago Justice Data,,,2016-04-18T18:43:37Z,2016-08-12T19:29:17Z
google-analytics-lib,https://github.com/datamade/google-analytics-lib,0,1,"Simple javascript file for adding Google Analytics to a site. Includes download, external link and email event tracking.",,JavaScript,2016-04-19T16:30:12Z,2016-04-19T16:30:13Z
dedupe-variable-person,https://github.com/datamade/dedupe-variable-person,3,1,Dedupe variable for person names. just people. no companies.,,Python,2016-04-20T14:54:43Z,2016-10-06T10:06:10Z
jail,https://github.com/datamade/jail,0,0,Cook County Jail Scraper,,Python,2016-04-25T14:18:26Z,2016-04-25T14:19:33Z
voterfile,https://github.com/datamade/voterfile,0,0,Experiments with Voter Files,,,2016-05-02T20:54:59Z,2016-05-02T20:54:59Z
fastcluster,https://github.com/datamade/fastcluster,0,0,See here: https://pypi.python.org/pypi/fastcluster,,C++,2016-05-03T22:48:29Z,2016-05-03T22:48:30Z
scrapelib,https://github.com/datamade/scrapelib,2,0,a library for scraping things,http://scrapelib.readthedocs.org/en/latest/,Python,2016-05-11T15:23:20Z,2016-10-23T15:53:48Z
illinois-sunshine,https://github.com/datamade/illinois-sunshine,2,0,:sunny: Illinois Sunshine. Keep an eye on money in Illinois politics.,http://illinoissunshine.org/,HTML,2016-05-13T18:49:56Z,2016-08-17T14:43:51Z
sra,https://github.com/datamade/sra,0,0,Mirror of Security Risk Assessment Tool from HHS,,HTML,2016-05-17T17:26:52Z,2016-05-17T17:31:23Z
my-reps,https://github.com/datamade/my-reps,11,7,:busts_in_silhouette: Enter your address to find your elected representatives. Powered by the Google Civic Information API,http://myreps.datamade.us,JavaScript,2016-06-24T17:52:32Z,2016-12-19T19:19:22Z
openness-project-nmid,https://github.com/datamade/openness-project-nmid,0,0,The Openness Project - New Mexico In Depth Campaign Finance Explorer,,Python,2016-07-05T18:32:09Z,2016-11-04T17:11:10Z
probation-resources-map,https://github.com/datamade/probation-resources-map,2,0,"Interactive, searchable map that helps people on probation find social, health, and cultural resources throughout Chicago",,JavaScript,2016-07-18T15:58:00Z,2016-12-01T16:26:45Z
illinois-criminal-justice,https://github.com/datamade/illinois-criminal-justice,2,0,Data extractions tools from Illinois State Reports on the Criminal Justice System,,Makefile,2016-07-19T16:40:54Z,2016-07-19T20:03:07Z
chicagojusticeproject,https://github.com/datamade/chicagojusticeproject,0,0,Copy of chicagojusticeproject.org,,,2016-08-01T22:11:41Z,2016-08-01T22:11:41Z
jekyll-html-hook,https://github.com/datamade/jekyll-html-hook,2,0,:anchor: Webhook listener for deploying Jekyll or static HTML sites,,Python,2016-08-04T15:11:29Z,2016-10-05T02:30:43Z
pyesridump,https://github.com/datamade/pyesridump,0,0,Scrapes an ESRI MapServer REST endpoint to spit out more generally-usable geodata.,,Python,2016-08-21T14:11:24Z,2016-08-21T14:11:25Z
dot-scrape,https://github.com/datamade/dot-scrape,0,0,Library for scraping dot net sites,,,2016-08-31T15:42:47Z,2016-08-31T15:42:47Z
wabbit_wappa,https://github.com/datamade/wabbit_wappa,0,0,Wabbit Wappa is a full-featured Python wrapper for the Vowpal Wabbit machine learning utility.,,Python,2016-09-11T14:24:34Z,2016-09-11T14:24:35Z
cps-data,https://github.com/datamade/cps-data,1,0,"Repository of data on the Chicago Public Schools and District, complement to https://github.com/datamade/school-report-cards",,Makefile,2016-09-15T15:49:09Z,2016-10-23T15:33:24Z
dedupe-vowpal,https://github.com/datamade/dedupe-vowpal,1,0,Vowpal Wabbit Active Labeler for Dedupe,,Python,2016-09-23T21:24:43Z,2016-09-25T11:41:34Z
CartoLib,https://github.com/datamade/CartoLib,4,2,A library for building interactive Carto maps.,,JavaScript,2016-10-05T21:47:56Z,2016-12-14T01:37:49Z
census_area,https://github.com/datamade/census_area,6,2,:large_blue_diamond: Get Census Data from the API for arbitrary areas,,Python,2016-10-07T20:44:04Z,2016-12-23T18:25:42Z
la-metro-councilmatic,https://github.com/datamade/la-metro-councilmatic,0,0,:metro: An instance of councilmatic for LA Metro,,HTML,2016-10-10T18:52:05Z,2016-12-23T17:15:45Z
illinois-ucr,https://github.com/datamade/illinois-ucr,1,0,Tools for working with Illinois crime reports.,,Python,2016-10-17T19:01:29Z,2016-11-23T17:22:18Z
readme-template,https://github.com/datamade/readme-template,0,0,📖 A template for documenting your code.,,,2016-10-24T15:13:44Z,2016-10-25T13:54:41Z
census,https://github.com/datamade/census,0,0,A Python wrapper for the US Census API,,Python,2016-10-26T21:19:34Z,2016-10-26T21:19:35Z
django-councilmatic-notifications,https://github.com/datamade/django-councilmatic-notifications,0,0,Notifications app for Django Councilmatic,,Python,2016-10-31T14:47:30Z,2016-10-31T14:47:54Z
Levenshtein_search,https://github.com/datamade/Levenshtein_search,0,0,Python search module for fast approximate string matching,,C,2016-11-08T15:56:27Z,2016-11-08T15:56:28Z
python-opencivicdata-divisions,https://github.com/datamade/python-opencivicdata-divisions,0,0,opencivicdata.divisions namespace pkg,,Python,2016-11-23T19:26:51Z,2016-11-23T19:26:53Z
college-costs,https://github.com/datamade/college-costs,0,0,A tool to help students weigh the costs and rewards of a college program. ,,CSS,2016-12-07T22:20:16Z,2016-12-07T22:20:18Z
neveragaindottech.github.io,https://github.com/datamade/neveragaindottech.github.io,0,0,Source files for the neveragain.tech site,https://neveragain.tech,HTML,2016-12-13T20:46:50Z,2016-12-13T20:46:51Z
readme-roundup,https://github.com/datamade/readme-roundup,0,0,:memo: python script that pulls a list of organization repos from the GitHub API into a CSV,,Python,2016-12-23T04:49:04Z,2016-12-23T20:20:46Z
